<?xml version="1.0" encoding="UTF-8"?>
<!DOCTYPE texts SYSTEM "../../../../dtd/ewdtext.dtd">
<texts lang="en" pubno="EM25T2E" style="font-size:6px;font-family:'Arial'" ver="2.1.2.9">
	<text textID="1">* 3 :2-Door Pick-Up Body Type</text>
	<text textID="2">* 4 :4-Door Pick-Up Body Type, Except Pick-Up Body Type</text>
	<text textID="3">Combination Meter Assembly</text>
	<text textID="4">Front Door Courtesy Light Switch Assembly LH</text>
	<text textID="5">Front Door Courtesy Light Switch Assembly RH</text>
	<text textID="6">No. 6 Junction Connector</text>
	<text textID="7">No. 8 Junction Connector</text>
	<text textID="8">No. 11 Junction Connector</text>
	<text textID="9">No. 11 Junction Connector , No. 21 Junction Connector</text>
	<text textID="10">No. 13 Junction Connector</text>
	<text textID="11">No. 16 Junction Connector</text>
	<text textID="12">No. 18 Junction Connector</text>
	<text textID="13">No. 21 Junction Connector</text>
	<text textID="14">No. 24 Junction Connector</text>
	<text textID="15">No. 24 Junction Connector , No. 26 Junction Connector</text>
	<text textID="16">No. 24 Junction Connector , No. 28 Junction Connector</text>
	<text textID="17">No. 26 Junction Connector</text>
	<text textID="18">No. 27 Junction Connector</text>
	<text textID="19">No. 27 Junction Connector , No. 28 Junction Connector</text>
	<text textID="20">No. 28 Junction Connector</text>
	<text textID="21">No. 31 Junction Connector</text>
	<text textID="22">Security</text>
	<text textID="23">Transponder Key Amplifier</text>
	<text textID="24">Transponder Key ECU Assembly</text>
	<text textID="25">Un-Lock Warning Switch Assembly</text>
</texts>
