<?xml version="1.0" encoding="UTF-8"?>
<!DOCTYPE texts SYSTEM "../../../../dtd/ewdtext.dtd">
<texts lang="en" pubno="EM25T2E" style="font-size:6px;font-family:'Arial'" ver="2.1.2.9">
	<text textID="1">* 5 :w/ Air Conditioner</text>
	<text textID="2">* 6 :Australia</text>
	<text textID="3">* 7 :Except Australia</text>
	<text textID="4">* 8 :Shielded</text>
	<text textID="5">A/C COMP Relay</text>
	<text textID="6">A/C Pressure Switch (Cooler Refrigerant Liquid Pipe B)</text>
	<text textID="7">Blower Resistor</text>
	<text textID="8">Cooler Stabilizer Amplifier Assembly</text>
	<text textID="9">Crank Position Sensor</text>
	<text textID="10">Diesel Engine Coolant Temperature Sensor</text>
	<text textID="11">E.F.I. Engine Coolant Temperature Sensor</text>
	<text textID="12">Front Blower Motor (Heater Blower Case)</text>
	<text textID="13">HTR Relay</text>
	<text textID="14">Heater Blower Switch Assembly</text>
	<text textID="15">Magnet Clutch Assembly</text>
	<text textID="16">No. 1 Cooler Thermistor</text>
	<text textID="17">No. 4 Junction Connector</text>
	<text textID="18">No. 7 Junction Connector</text>
	<text textID="19">No. 8 Junction Connector</text>
	<text textID="20">No. 10 Junction Connector</text>
	<text textID="21">No. 10 Junction Connector , No. 16 Junction Connector</text>
	<text textID="22">No. 10 Junction Connector , No. 19 Junction Connector</text>
	<text textID="23">No. 12 Junction Connector</text>
	<text textID="24">No. 12 Junction Connector , No. 16 Junction Connector</text>
	<text textID="25">No. 13 Junction Connector</text>
	<text textID="26">No. 16 Junction Connector</text>
	<text textID="27">No. 19 Junction Connector</text>
	<text textID="28">No. 32 Junction Connector</text>
	<text textID="29">Short Connector</text>
</texts>
