<?xml version="1.0" encoding="UTF-8"?>
<!DOCTYPE texts SYSTEM "../../../../dtd/ewdtext.dtd">
<texts lang="en" pubno="EM25T2E" style="font-size:6px;font-family:'Arial'" ver="2.1.2.9">
	<text textID="1">* 2 :12V Battery Type</text>
	<text textID="2">* 3 :24V Battery Type</text>
	<text textID="3">* 4 :1HZ 12V Battery Type, 1VD-FTV</text>
	<text textID="4">* 5 :1HZ 24V Battery Type</text>
	<text textID="5">* 6 :Multi Clock Type</text>
	<text textID="6">* 7 :w/ ABS</text>
	<text textID="7">*21 :w/o ABS</text>
	<text textID="8">*22 :LHD 1GR-FE w/o ABS</text>
	<text textID="9">*23 :1HZ w/o ABS</text>
	<text textID="10">Brake Actuator Assembly</text>
	<text textID="11">Clock Assembly</text>
	<text textID="12">Combination Meter Assembly</text>
	<text textID="13">Meter Micro Computer</text>
	<text textID="14">No. 8 Junction Connector</text>
	<text textID="15">No. 9 Junction Connector</text>
	<text textID="16">No. 9 Junction Connector , No. 21 Junction Connector</text>
	<text textID="17">No. 11 Junction Connector</text>
	<text textID="18">No. 11 Junction Connector , No. 21 Junction Connector</text>
	<text textID="19">No. 12 Junction Connector</text>
	<text textID="20">No. 13 Junction Connector</text>
	<text textID="21">No. 18 Junction Connector</text>
	<text textID="22">No. 21 Junction Connector</text>
	<text textID="23">No. 24 Junction Connector</text>
	<text textID="24">No. 24 Junction Connector , No. 28 Junction Connector</text>
	<text textID="25">No. 24 Junction Connector , No. 29 Junction Connector</text>
	<text textID="26">No. 25 Junction Connector</text>
	<text textID="27">No. 25 Junction Connector , No. 28 Junction Connector</text>
	<text textID="28">No. 25 Junction Connector , No. 29 Junction Connector</text>
	<text textID="29">No. 28 Junction Connector</text>
	<text textID="30">No. 29 Junction Connector</text>
	<text textID="31">Speedometer Sensor</text>
	<text textID="32">Thermistor Assembly</text>
</texts>
