<?xml version="1.0" encoding="UTF-8"?>
<!DOCTYPE texts SYSTEM "../../../../dtd/ewdtext.dtd">
<texts lang="en" pubno="EM25T2E" style="font-size:6px;font-family:'Arial'" ver="2.1.2.9">
	<text textID="1">Combination Meter Assembly</text>
	<text textID="2">FR FOG Relay</text>
	<text textID="3">Fog Light Assembly LH</text>
	<text textID="4">Fog Light Assembly RH</text>
	<text textID="5">Fog Light Switch</text>
	<text textID="6">Front</text>
	<text textID="7">Front Fog</text>
	<text textID="8">Head</text>
	<text textID="9">Headlight Dimmer Switch Assembly</text>
	<text textID="10">Light Control Switch</text>
	<text textID="11">No. 9 Junction Connector</text>
	<text textID="12">No. 31 Junction Connector</text>
	<text textID="13">Rear</text>
	<text textID="14">TAIL Relay</text>
	<text textID="15">Tail</text>
</texts>
