<?xml version="1.0" encoding="UTF-8"?>
<!DOCTYPE texts SYSTEM "../../../../dtd/ewdtext.dtd">
<texts lang="en" pubno="EM25T2E" style="font-size:6px;font-family:'Arial'" ver="2.1.2.9">
	<text textID="1">* 5 :1GR-FE, 1VD-FTV, 1HZ 12V Battery Type</text>
	<text textID="2">* 6 :1HZ 24V Battery Type</text>
	<text textID="3">* 7 :1HZ 12V Battery Type</text>
	<text textID="4">* 8 :2-Door Pick-Up Body Type</text>
	<text textID="5">* 9 :4-Door Pick-Up Body Type</text>
	<text textID="6">*10 :Except Pick-Up Body Type</text>
	<text textID="7">*11 :w/ VSC</text>
	<text textID="8">*12 :w/o VSC</text>
	<text textID="9">*13 :Before Jan. 2017 Production</text>
	<text textID="10">*14 :From Jan. 2017 Production</text>
	<text textID="11">Buzzer</text>
	<text textID="12">Combination Meter Assembly</text>
	<text textID="13">Front Door Courtesy Light Switch Assembly LH</text>
	<text textID="14">Front Door Courtesy Light Switch Assembly RH</text>
	<text textID="15">Head</text>
	<text textID="16">Headlight Dimmer Switch Assembly</text>
	<text textID="17">Light Control Switch</text>
	<text textID="18">No. 9 Junction Connector</text>
	<text textID="19">No. 9 Junction Connector , No. 36 Junction Connector , No. 21 Junction Connector</text>
	<text textID="20">No. 11 Junction Connector</text>
	<text textID="21">No. 11 Junction Connector , No. 21 Junction Connector</text>
	<text textID="22">No. 16 Junction Connector</text>
	<text textID="23">No. 21 Junction Connector</text>
	<text textID="24">No. 27 Junction Connector</text>
	<text textID="25">No. 27 Junction Connector , No. 28 Junction Connector</text>
	<text textID="26">No. 28 Junction Connector</text>
	<text textID="27">No. 30 Junction Connector</text>
	<text textID="28">No. 31 Junction Connector</text>
	<text textID="29">No. 33 Junction Connector</text>
	<text textID="30">No. 36 Junction Connector</text>
	<text textID="31">TAIL Relay</text>
	<text textID="32">Tail</text>
</texts>
